{
  "$schema": "http://json-schema.org/draft-07/schema#",
  "title": "xinci 运行清单",
  "description": "每次运行一个小 JSON,不写过程日志(数据极简原则)。单步文件名:运行/<YYYY-MM-DD>[-HHMM]-<skill>.json；xinci-run 自动文件名:<YYYY-MM-DD>-<HHMMSS>-<run-token>-xinci-run.json。连续运行由 run_controller record-round 原子维护一份清单,轮次只追加不覆盖。",
  "type": "object",
  "required": ["date", "skill"],
  "properties": {
    "date": { "type": "string", "description": "运行日期 YYYY-MM-DD" },
    "run_id": { "type": "string", "description": "xinci-run 清单关联的可恢复运行会话 ID" },
    "skill": {
      "type": "string",
      "enum": ["xinci-scan", "xinci-track", "xinci-qualify", "xinci-decide", "xinci-run"],
      "description": "产生本清单的 skill"
    },
    "sources_opened": { "type": "array", "items": { "type": "string" }, "description": "本次实际打开过的来源 URL;未打开的不得列入" },
    "sources_blocked": { "type": "array", "items": { "type": "string" }, "description": "尝试打开但被拦截的来源(浏览器策略/登录墙/CAPTCHA),附拦截现象;记录事实以便换源与复盘覆盖面" },
    "candidates_touched": { "type": "array", "items": { "type": "string" }, "description": "本次触及的候选 slug" },
    "billable_calls": { "type": "integer", "description": "计费查询次数(Semrush 等);扫描阶段应为 0" },
    "funnel": {
      "type": "object",
      "description": "扫描漏斗数据(xinci-scan 四层)。四个去向加总须等于 extracted——每个被提取的方向都要有归宿,不许无声丢弃;validate_ledger.py 强制此等式。两条不参与等式的口径:①第 0 层去重命中的方向不计入 extracted(它们上一次已有归宿,再计一次等式必然算不平);②消化存量 captured 的深审记 carryover_audited,不记 deep_audited。自 2026-08-19 起 funnel 本身也强制存在:xinci-scan 清单必须带顶层 funnel,xinci-run 清单每一轮必须带 rounds[].funnel(该轮没扫描就把 extracted 与四个去向五项全写 0——这五项都是 required,只写四个去向会被判缺 extracted;还了债的轮次记得补上可选的 carryover_audited,否则看不出那一轮花了什么);阈值之前的历史清单豁免。",
      "required": ["extracted", "rejected_zero_cost", "rejected_g1", "deep_audited", "queued"],
      "properties": {
        "extracted": { "type": "integer", "description": "第 1 层提取、经第 0 层去重后进入第 2 层筛选的正式方向数;trigger 不计入;连续模式仅 mode=full 可大于 0" },
        "rejected_zero_cost": { "type": "integer", "description": "历史机器名,准确语义是第 2 层筛除:G0/G4/G5/G6-G7 预筛/无任务秒弃,以及历史或兼容记录中陷阱型的 G3 验证失败;均已进淘汰方向索引。本字段名不代表从未打开浏览器" },
        "rejected_g1": { "type": "integer", "description": "第 3 层 G1 快筛否决,已批量追加进淘汰方向索引(gate=G1,reason 带首屏证据要点)。只统计索引这一侧:已注册进账本的候选补跑 G1 被否时走账本的 captured→rejected,不记本格——funnel 归格按这个方向属于本轮还是存量定,本轮的记 deep_audited、上轮存量的记 carryover_audited" },
        "deep_audited": { "type": "integer", "description": "第 4 层实际做完 G2/G3 深审的数量(配额 ≤5);含本轮第 2 层陷阱验证存活、注册后补跑 G1/G2 的那一类——它做过 G3 深审、留痕在账本,与深审判否的候选同构,不记 rejected_g1。上轮存量 captured 的深审不记本格,记 carryover_audited" },
        "queued": { "type": "integer", "description": "本轮没走完的存活方向(超深审配额的,以及超 G1 上限本轮没搜的),注册为 captured 待下轮消化" },
        "carryover_audited": { "type": "integer", "description": "可选,不参与加总等式:本轮消化存量 captured 所做的深审数;正常至多 5,debt_only 至多 10" }
      },
      "additionalProperties": false
    },
    "notes": { "type": "array", "items": { "type": "string" }, "description": "值得留档的事实要点:screen_unsatisfiable 假设、额度耗尽提示要点、blocker 记录等" },
    "rounds": {
      "type": "array",
      "description": "xinci-run 专用:每轮追加一条,顶层字段作全局汇总",
      "items": {
        "type": "object",
        "required": ["round"],
        "properties": {
          "round": { "type": "integer", "description": "轮次序号,从 1 起" },
          "sources_opened": { "type": "array", "items": { "type": "string" }, "description": "本轮打开的来源 URL" },
          "sources_blocked": { "type": "array", "items": { "type": "string" }, "description": "本轮被拦截的来源" },
          "candidates_touched": { "type": "array", "items": { "type": "string" }, "description": "本轮触及的候选 slug" },
          "billable_calls": { "type": "integer", "description": "本轮计费查询次数" },
        "funnel": {
          "type": "object",
          "description": "扫描漏斗数据(xinci-scan 四层)。四个去向加总须等于 extracted——每个被提取的方向都要有归宿,不许无声丢弃;validate_ledger.py 强制此等式。两条不参与等式的口径:①第 0 层去重命中的方向不计入 extracted(它们上一次已有归宿,再计一次等式必然算不平);②消化存量 captured 的深审记 carryover_audited,不记 deep_audited。自 2026-08-19 起 funnel 本身也强制存在:xinci-scan 清单必须带顶层 funnel,xinci-run 清单每一轮必须带 rounds[].funnel(该轮没扫描就把 extracted 与四个去向五项全写 0——这五项都是 required,只写四个去向会被判缺 extracted;还了债的轮次记得补上可选的 carryover_audited,否则看不出那一轮花了什么);阈值之前的历史清单豁免。",
          "required": ["extracted", "rejected_zero_cost", "rejected_g1", "deep_audited", "queued"],
          "properties": {
            "extracted": { "type": "integer", "description": "第 1 层提取、经第 0 层去重后进入第 2 层筛选的正式方向数;trigger 不计入;连续模式仅 mode=full 可大于 0" },
            "rejected_zero_cost": { "type": "integer", "description": "历史机器名,准确语义是第 2 层筛除:G0/G4/G5/G6-G7 预筛/无任务秒弃,以及历史或兼容记录中陷阱型的 G3 验证失败;均已进淘汰方向索引。本字段名不代表从未打开浏览器" },
            "rejected_g1": { "type": "integer", "description": "第 3 层 G1 快筛否决,已批量追加进淘汰方向索引(gate=G1,reason 带首屏证据要点)。只统计索引这一侧:已注册进账本的候选补跑 G1 被否时走账本的 captured→rejected,不记本格——funnel 归格按这个方向属于本轮还是存量定,本轮的记 deep_audited、上轮存量的记 carryover_audited" },
            "deep_audited": { "type": "integer", "description": "第 4 层实际做完 G2/G3 深审的数量(配额 ≤5);含本轮第 2 层陷阱验证存活、注册后补跑 G1/G2 的那一类——它做过 G3 深审、留痕在账本,与深审判否的候选同构,不记 rejected_g1。上轮存量 captured 的深审不记本格,记 carryover_audited" },
            "queued": { "type": "integer", "description": "本轮没走完的存活方向(超深审配额的,以及超 G1 上限本轮没搜的),注册为 captured 待下轮消化" },
            "carryover_audited": { "type": "integer", "description": "可选,不参与加总等式:本轮消化存量 captured 所做的深审数;正常至多 5,debt_only 至多 10" }
          },
          "additionalProperties": false
        },
          "notes": { "type": "array", "items": { "type": "string" }, "description": "本轮事实要点" }
        },
        "additionalProperties": false
      }
    }
  },
  "additionalProperties": false
}
