{
  "date": "2026-08-23",
  "skill": "xinci-scan",
  "sources_opened": [
    "https://www.semrush.com/analytics/keywordmagic/?db=us&keyword=statute+of+limitations",
    "https://www.semrush.com/analytics/keywordmagic/?db=us&keyword=cost+per+square+foot",
    "https://www.semrush.com/analytics/keywordmagic/?db=us&keyword=commercial+rent+per+square+foot",
    "https://www.google.com/search?q=statute+of+limitations+florida&gl=us&hl=en&num=20&pws=0"
  ],
  "billable_calls": 0,
  "funnel": {
    "extracted": 3,
    "rejected_zero_cost": 2,
    "rejected_g1": 0,
    "deep_audited": 1,
    "queued": 0
  },
  "notes": [
    "lane=mature 首轮:检验数据采集指南「广告线的选源方法」。命中率 0/3,无候选注册。完整记录见闸门校准.md 第 8 节。",
    "未走 xinci-run:xinci-scan 与 xinci-run 全文均无 lane,自动循环会把候选一律注册成 lane=new;且第 1 层的源(changelog/release note)天生产出天级新词,正是 mature 道要避开的。手工单步 --by user。",
    "extracted 单位是种子而非方向:mature 道的广度提取与量级测量合并成一步(Semrush 一次查询同时给出查询列表与量级)。",
    "rejected_zero_cost=2 是 G6 量级前置筛除(cost per square foot、commercial rent per square foot),未读 SERP;deep_audited=1 是 statute of limitations florida 的完整首页结构阅读(六条弱守信号 2/6,并命中陷阱类别六)。",
    "Semrush 未登录,只能用公开免费版,总额度 3 次查询、每次仅回 15 行,故簇量统计是下界;billable_calls=0 因走免费额度。",
    "SERP 阅读改用应用内浏览器以满足美区/桌面/未登录;用户 Chrome 登着 Google 会个性化。",
    "本轮据实修订选源方法四处(两处是原稿设计错误),并给淘汰方向索引补了 lane 字段。"
  ]
}