{
  "date": "2026-08-22",
  "skill": "xinci-run",
  "run_id": "run-20260822T151847Z-d93a5d96",
  "sources_opened": [
    "https://www.google.com/search?q=EU+product+compliance+regulations+deadlines+2026+2027+per+product+obligations+manufacturers&gl=us&hl=en&pws=0",
    "https://passportcraft.com/",
    "https://www.google.com/search?q=battery+passport+software+2027+carbon+footprint+recycled+content+compliance+tool&gl=us&hl=en&pws=0",
    "https://www.google.com/search?q=furniture+digital+product+passport+ESPR+delegated+act+compliance+software&gl=us&hl=en&pws=0"
  ],
  "sources_blocked": [],
  "candidates_touched": [],
  "billable_calls": 0,
  "notes": [
    "本轮性质是闸门校准测试,不是扫描轮,funnel 因此五项全 0。产出是 xinci-workflow/xinci-core/闸门校准.md 的第三节,不是账本候选。",
    "步骤 1 无待办:captured 存量 0;11 个 tracking 候选最早 2026-08-27 才满 7 天跨度。carryover_audited=0。",
    "检验的是上一节从唯一确证成功案例(ppwr-empty-space-ratio)反推出的七条正向选择器。假设:PPWR 不是孤例,欧盟产品合规法规系统性制造「每个 SKU × 每个成员国」的义务,该家族其他成员也应已出现同构的小而专付费工具。",
    "复现成立 2/2。PPWR:ppwrcopilot.com(£49–199/月、190+ 机构)与 ppwrconnect.com(€29/月起)。DPP/ESPR:passportcraft.com —— 单一义务专用工具、免费起步转付费、24+ 篇合规指南(2026-02/03/07)、做了中文本地化直打中国出口商、另有法国专属义务横幅;付费者规模写在它自己首页「影响超过 160,000 家向欧洲销售的纺织企业」。另见 CRA 的 continueops.com 已有产品形态(搜索结果带 4.8 分/24 评价)。",
    "选择器的性质要说清:它不识别空位,它识别已验证的市场。按上一节对 G3 的批评,这正是应据以行动的信号。正确用法是先用选择器定位家族,再用「占位者是小而专的新站还是成规模厂商」判断还能不能进,而不是用 G3 的数量线一票否决。",
    "本轮修正了我自己 2026-08-21 第 6 轮写错的一条判据。当时从加州替换轮胎能效标准归纳出 pattern「生效日远在未来的变化」。对企业合规付费者这条是错的:PassportCraft 在 2026 年初就在为 2027-02 至 2029 的义务卖工具,ppwrcopilot 也在 2026-08-12 生效前就上线并积累到 190+ 机构。企业面对有日期的合规义务会提前 12–24 个月准备,提前入场正是赢家做法。加州轮胎那条仍成立,是因为付费者是消费者——消费者不为 2029 年的换胎规则提前做事。修正后需加付费者类型限定,已写入校准文档。",
    "本轮刻意不往淘汰索引写否决。理由:①索引条目永久且「永不复活」,用一道正在被证明有校准问题的闸门写永久否决会把错误固化;②本轮是校准测试而非扫描。枚举出的 12 条义务(DPP、CRA、电池护照、强迫劳动法规、GPSR、CBAM、成员国 EPR 注册、玩具安全法规、AI 法案、数据法案、新产品责任指令、EUDR)作为正向选择器候选池留在校准文档,待闸门修订后再定如何进账本。",
    "本轮同为闸门校准测试,不是扫描轮,funnel 五项全 0,产出为闸门校准.md 第四节。步骤 1 无待办(captured 0;tracking 最早 2026-08-27 才满跨度)。",
    "测量一:电池护照(2027-02-18 强制,生效前 6 个月)已占满——circularise.com 专门产品页、digiprodpass.com(2026-01-08)、dpp-tool.com(2026-02-22)、makersite.io、thebatterypass.eu、crunch-is.com、iTAC Software AG。",
    "测量二(决定性):家具 DPP 的授权法案预计 2028 年才定稿、此刻规则尚未具体化,却同样已占满——renoon.com 家具 DPP 专页、digiprodpass.com、bluestonepim.com(2026-03-04)、myproductpassport.eu(2025-11-27)、productipedia.com、asuene.com、SAP,而 tributech.io 的 ESPR DPP 文章日期是 2024-12-03,比家具授权法案预期定稿早约四年。",
    "由此推翻我自己第三轮刚写下的「生效前 12–24 个月是入场窗口」。正确的统一结论是:位置不是在任务出现之后被占的,而是在任务出现之前就被占的——预期本身可变现。消费者面答案与对象同时到(小时到数天),企业合规面答案早于义务到(规则未公布即已有内容)。这解释了三次运行 682 个方向 0 存活:工作流在找一个「措辞已出现、答案未出现」的时间差,而这个差在两类市场里都不存在。",
    "但同一批证据里出现了唯一可行的玩法。看占位者是什么东西:家具 DPP 那格里 bluestonepim 是 PIM 软件商的内容营销,SAP/asuene/Tributech 同理,productipedia 是资源汇总——它们写的是解释文章,不是能替你干活的工具。而 ppwrcopilot 做的正相反:别人写「PPWR 要求你算空隙率」,它做了按 SKU 生成带法条引用档案 PDF 的生成器,按 £49–199/月收费、190+ 家机构。所以可行玩法不是找没人占的查询,而是在已被占的查询上做出占位者没做的那个工具。",
    "这与本文档第一节从误杀案例反推出的 G3 修订(硬否决只留给「≥2 个完成任务的工具或完整实现」,文章降级为扣分项)从正反两侧独立得到同一答案。据此给出 G1/G2/G3 的角色重排建议:G1 保留;G2 保留并加强(读满第一页,其原始教训是对的);G3 改问「占位者里有几个是能替用户完成任务的工具」,0–1 个放行,≥2 个真工具才否决。",
    "本轮未做的事已写入文档:只测了 DPP 家族两个时间点,「占位发生在规则公布之前」是从 Tributech 2024-12 一例推的、样本为一;未验证「占位者只写了文章」在电池护照一格是否也成立(circularise 的产品页看起来是真工具,若如此该格应否决,与家具格结论不同,需逐格实测);新 G3 判据未在任何真实候选上试跑。"
  ],
  "rounds": [
    {
      "round": 1,
      "sources_opened": [
        "https://www.google.com/search?q=EU+product+compliance+regulations+deadlines+2026+2027+per+product+obligations+manufacturers&gl=us&hl=en&pws=0",
        "https://passportcraft.com/"
      ],
      "sources_blocked": [],
      "candidates_touched": [],
      "billable_calls": 0,
      "funnel": {
        "extracted": 0,
        "rejected_zero_cost": 0,
        "rejected_g1": 0,
        "deep_audited": 0,
        "queued": 0,
        "carryover_audited": 0
      },
      "notes": [
        "本轮性质是闸门校准测试,不是扫描轮,funnel 因此五项全 0。产出是 xinci-workflow/xinci-core/闸门校准.md 的第三节,不是账本候选。",
        "步骤 1 无待办:captured 存量 0;11 个 tracking 候选最早 2026-08-27 才满 7 天跨度。carryover_audited=0。",
        "检验的是上一节从唯一确证成功案例(ppwr-empty-space-ratio)反推出的七条正向选择器。假设:PPWR 不是孤例,欧盟产品合规法规系统性制造「每个 SKU × 每个成员国」的义务,该家族其他成员也应已出现同构的小而专付费工具。",
        "复现成立 2/2。PPWR:ppwrcopilot.com(£49–199/月、190+ 机构)与 ppwrconnect.com(€29/月起)。DPP/ESPR:passportcraft.com —— 单一义务专用工具、免费起步转付费、24+ 篇合规指南(2026-02/03/07)、做了中文本地化直打中国出口商、另有法国专属义务横幅;付费者规模写在它自己首页「影响超过 160,000 家向欧洲销售的纺织企业」。另见 CRA 的 continueops.com 已有产品形态(搜索结果带 4.8 分/24 评价)。",
        "选择器的性质要说清:它不识别空位,它识别已验证的市场。按上一节对 G3 的批评,这正是应据以行动的信号。正确用法是先用选择器定位家族,再用「占位者是小而专的新站还是成规模厂商」判断还能不能进,而不是用 G3 的数量线一票否决。",
        "本轮修正了我自己 2026-08-21 第 6 轮写错的一条判据。当时从加州替换轮胎能效标准归纳出 pattern「生效日远在未来的变化」。对企业合规付费者这条是错的:PassportCraft 在 2026 年初就在为 2027-02 至 2029 的义务卖工具,ppwrcopilot 也在 2026-08-12 生效前就上线并积累到 190+ 机构。企业面对有日期的合规义务会提前 12–24 个月准备,提前入场正是赢家做法。加州轮胎那条仍成立,是因为付费者是消费者——消费者不为 2029 年的换胎规则提前做事。修正后需加付费者类型限定,已写入校准文档。",
        "本轮刻意不往淘汰索引写否决。理由:①索引条目永久且「永不复活」,用一道正在被证明有校准问题的闸门写永久否决会把错误固化;②本轮是校准测试而非扫描。枚举出的 12 条义务(DPP、CRA、电池护照、强迫劳动法规、GPSR、CBAM、成员国 EPR 注册、玩具安全法规、AI 法案、数据法案、新产品责任指令、EUDR)作为正向选择器候选池留在校准文档,待闸门修订后再定如何进账本。"
      ]
    },
    {
      "round": 2,
      "sources_opened": [
        "https://www.google.com/search?q=battery+passport+software+2027+carbon+footprint+recycled+content+compliance+tool&gl=us&hl=en&pws=0",
        "https://www.google.com/search?q=furniture+digital+product+passport+ESPR+delegated+act+compliance+software&gl=us&hl=en&pws=0"
      ],
      "sources_blocked": [],
      "candidates_touched": [],
      "billable_calls": 0,
      "funnel": {
        "extracted": 0,
        "rejected_zero_cost": 0,
        "rejected_g1": 0,
        "deep_audited": 0,
        "queued": 0,
        "carryover_audited": 0
      },
      "notes": [
        "本轮同为闸门校准测试,不是扫描轮,funnel 五项全 0,产出为闸门校准.md 第四节。步骤 1 无待办(captured 0;tracking 最早 2026-08-27 才满跨度)。",
        "测量一:电池护照(2027-02-18 强制,生效前 6 个月)已占满——circularise.com 专门产品页、digiprodpass.com(2026-01-08)、dpp-tool.com(2026-02-22)、makersite.io、thebatterypass.eu、crunch-is.com、iTAC Software AG。",
        "测量二(决定性):家具 DPP 的授权法案预计 2028 年才定稿、此刻规则尚未具体化,却同样已占满——renoon.com 家具 DPP 专页、digiprodpass.com、bluestonepim.com(2026-03-04)、myproductpassport.eu(2025-11-27)、productipedia.com、asuene.com、SAP,而 tributech.io 的 ESPR DPP 文章日期是 2024-12-03,比家具授权法案预期定稿早约四年。",
        "由此推翻我自己第三轮刚写下的「生效前 12–24 个月是入场窗口」。正确的统一结论是:位置不是在任务出现之后被占的,而是在任务出现之前就被占的——预期本身可变现。消费者面答案与对象同时到(小时到数天),企业合规面答案早于义务到(规则未公布即已有内容)。这解释了三次运行 682 个方向 0 存活:工作流在找一个「措辞已出现、答案未出现」的时间差,而这个差在两类市场里都不存在。",
        "但同一批证据里出现了唯一可行的玩法。看占位者是什么东西:家具 DPP 那格里 bluestonepim 是 PIM 软件商的内容营销,SAP/asuene/Tributech 同理,productipedia 是资源汇总——它们写的是解释文章,不是能替你干活的工具。而 ppwrcopilot 做的正相反:别人写「PPWR 要求你算空隙率」,它做了按 SKU 生成带法条引用档案 PDF 的生成器,按 £49–199/月收费、190+ 家机构。所以可行玩法不是找没人占的查询,而是在已被占的查询上做出占位者没做的那个工具。",
        "这与本文档第一节从误杀案例反推出的 G3 修订(硬否决只留给「≥2 个完成任务的工具或完整实现」,文章降级为扣分项)从正反两侧独立得到同一答案。据此给出 G1/G2/G3 的角色重排建议:G1 保留;G2 保留并加强(读满第一页,其原始教训是对的);G3 改问「占位者里有几个是能替用户完成任务的工具」,0–1 个放行,≥2 个真工具才否决。",
        "本轮未做的事已写入文档:只测了 DPP 家族两个时间点,「占位发生在规则公布之前」是从 Tributech 2024-12 一例推的、样本为一;未验证「占位者只写了文章」在电池护照一格是否也成立(circularise 的产品页看起来是真工具,若如此该格应否决,与家具格结论不同,需逐格实测);新 G3 判据未在任何真实候选上试跑。"
      ]
    }
  ]
}
