{
  "date": "2026-08-23",
  "skill": "xinci-scan",
  "sources_opened": [
    "https://www.google.com/search?q=2015+honda+civic+lug+nut+torque+spec&gl=us&hl=en&num=20&pws=0",
    "https://www.google.com/search?q=john+deere+d130+mower+deck+belt+size&gl=us&hl=en&num=20&pws=0"
  ],
  "sources_blocked": [
    "https://diy.stackexchange.com/questions?tab=Frequent — 站点弹出机器人验证(安全验证页),CAPTCHA 不绕,换用 Google SERP 作类型四/类型三的探针工具",
    "https://www.semrush.com/analytics/keywordmagic/ — 扩展所连的 Chrome 配置未登录 Semrush(右上 Log In/Sign Up,表格空骨架 All keywords 0,注册弹窗为硬门 Escape 关不掉);登录与建账号不由我执行,已交还用户"
  ],
  "billable_calls": 0,
  "funnel": {
    "extracted": 2,
    "rejected_zero_cost": 0,
    "rejected_g1": 0,
    "deep_audited": 2,
    "queued": 0
  },
  "notes": [
    "lane=mature 第二批探针:改用修订后方法指定的类型三(逐对象查表)。两个探针结论相反,由此得出修订五。完整记录见闸门校准.md 第 8 节。",
    "被淘汰:john deere d130 mower deck belt size(弱守 0–1/6,零售商与 V-Belt Guys 的适配表占满首页),已入索引 lane=mature。",
    "待测(未注册):2015 honda civic lug nut torque spec —— 弱守 4–5/6 通过,是本次全部调查中第一个通过弱守检验的方向。9 条结果里 6 条论坛帖,第 1 条为 2009-01,且结果互相矛盾(80 对 94 ft-lbs)。",
    "为什么不注册:mature 道的入门闸门是 G6 量级,而 Semrush 未登录导致量级无法测量。没跑的闸门不写进账本,也不占索引(它没有失败的闸门)。Semrush 可用后先补量级,过阈值再 register --lane mature。",
    "缺口记录:契约里没有'通过弱守但量级待测'这一状态的存放处。本轮暂存于运行清单 notes;若这种情形复现,再考虑给 mature 道补一个排队位语义。"
  ]
}