{
  "date": "2026-08-23",
  "skill": "xinci-scan",
  "sources_opened": [
    "https://v.taobao-seo.com/#/dashboard",
    "https://zh-d-semrush-d-com-s-sem.v.taobao-seo.com/analytics/keywordmagic/?q=lug+nut+torque&db=us&type=phrase&mode=0",
    "https://zh-d-semrush-d-com-s-sem.v.taobao-seo.com/analytics/keywordmagic/?q=torque+specs&db=us&type=phrase&mode=0",
    "https://www.google.com/search?q=cylinder+head+torque+specs+chevy+350&gl=us&hl=en&num=20&pws=0"
  ],
  "billable_calls": 3,
  "candidates_touched": [
    "vehicle-fastener-torque-specs"
  ],
  "funnel": {
    "extracted": 0,
    "rejected_zero_cost": 0,
    "rejected_g1": 0,
    "deep_audited": 0,
    "queued": 0,
    "carryover_audited": 1
  },
  "notes": [
    "承接 2026-08-23-1450 那一批:用户提供共享账号入口后补上量级实测。额度日 300 / 月 6000,本次用 3 次(lug nut torque 词组匹配、torque specs 词组匹配、以及切匹配模式那一次),每次都改变了决策。",
    "本批没有新提取,故 extracted 与四个去向全 0;所做的是补测 2026-08-23-1450 留在待测的那一个方向的量级,记 carryover_audited=1(不参与加总等式)。该方向的 deep_audited 已在 1450 那份清单里计过,此处再计一次即重复计数——漏斗等式当场把这个错拦下了。",
    "量级:词组匹配 lug nut torque 5,359 词/104,230 月量;torque specs 31,955 词/213,900 月量;保守合计约 30 万/月。CPC 头部 1.72、长尾大量 0.00–0.03。",
    "广告线边际:CTR 5%(契约默认)→ 75–120 美元/月,不过;CTR 10%(可辩护)→ 150–240 美元/月,卡在 200 参考线两侧。不许用 20%——第二个子查询 cylinder head torque specs chevy 350 只有约 3/6,Summit Racing/Speedway Motors/JEGS 在场,整簇防守不均匀。",
    "已注册 vehicle-fastener-torque-specs(lane=mature, captured, expiry 2026-09-23),未带 gates:G0/G1/G4/G5 未跑,不伪装成已出闸。",
    "下一步:订阅线专审。技师是有预算、逐车型重复的付费者,但 ALLDATA/Mitchell1/Identifix 以持牌 OEM 数据经营该市场——这不是 CAC 问题,是能否做出同等产品的问题。",
    "定量确认了夹逼:CPC 越低防守越弱(法律 4–12 强守、造价 1.15–2.68 强守、扭矩 0.00–1.72 弱守),是同一原因的两面。完整记录见闸门校准.md 第 8.8 节。"
  ]
}